PK,NOMBRE,NOMBRE-RECON,DESCRIPCION-ENTIDAD,HORARIO,EQUIPAMIENTO,TRANSPORTE,DESCRIPCION,ACCESIBILIDAD,CONTENT-URL,NOMBRE-VIA,CLASE-VIAL,TIPO-NUM,NUM,PLANTA,PUERTA,ESCALERAS,ORIENTACION,LOCALIDAD,PROVINCIA,CODIGO-POSTAL,COD-BARRIO,BARRIO,BARRIO-RECON,COD-DISTRITO,DISTRITO,DISTRITO-RECON,COORDENADA-X,COORDENADA-Y,ID,LATITUD,LONGITUD,TELEFONO,TELEFONO_1,TELEFONO_2,FAX,EMAIL,TIPO
5727435,museo-de-bomberos-de-madrid,https://wikidata.org/entity/Q113329713,,"Lunes, miércoles, jueves y viernes: 12:00 horas (martes y fin de semana, cerrado)","El acceso se realizará mediante RESERVA en el que aparecerán las sesiones y plazas disponibles.    Unicamente se permiten las visitas guiadas    El personal del museo mostrará al visitante la exposición permanente, que cuenta con una interesante colección de vehículos y otros materiales que han formado parte de la Historia del Cuerpo de Bomberos de Madrid.      Actividades del Grupo Pedagógico con visitas de colegios    Se realizan visitas guiadas a colegios, demostraciones prácticas?y charlas de prevención    Sala polivalente     Puede ser utilizada para la organización de charlas, encuentros y otras actividades culturales.",Metro: L1- Buenos Aires  Bus: 141 y 143,,1,http://www.madrid.es/sites/v/index.jsp?vgnextchannel=bfa48ab43d6bb410VgnVCM100000171f5a0aRCRD&vgnextoid=9f0966a8bba49210VgnVCM2000000c205a0aRCRD,boada,CALLE,V,4.0,,,,,MADRID,MADRID,28038,6,numancia,https://wikidata.org/entity/Q10338144,13,puente-de-vallecas,https://wikidata.org/entity/Q2003054,444504,4471753,4445044471753,40.39453,-3.653931,Actualmente no disponible.,0,,0,museobomberosmadrid@madrid.es,/contenido/entidadesYorganismos/Museos
2090,calcografia-nacional,https://wikidata.org/entity/Q111818807,"La institución posee la más importante colección de láminas de grabado calcográfico de España. El número de matrices metálicas supera las ocho mil obras, abarcando un amplio periodo cronológico, desde el siglo XVI al XXI.",Consultar en la web.,,"Metro: Sol (líneas 1, 2, 3), Sevilla (línea 2), Gran Vía (líneas 1 y 5).  Bus: 002, 52, 46, 51, 150, 5, 15, 20., M3  Cercanías Renfe: Sol (líneas C3, C4 y Regional).  Bicimad: Estaciones 1a y 1b (Puerta del Sol, 1) y 28 (calle Alcalá, 27).  Aparcamiento: Sevilla (41) y  calle Alcalá.(17).",,3,http://www.madrid.es/sites/v/index.jsp?vgnextchannel=bfa48ab43d6bb410VgnVCM100000171f5a0aRCRD&vgnextoid=7169ef4d7f71c010VgnVCM1000000b205a0aRCRD,alcala,CALLE,V,13.0,,,,,MADRID,MADRID,28014,6,sol,https://wikidata.org/entity/Q2465181,1,centro,https://wikidata.org/entity/Q1763376,440558,4474350,4405584474350,40.41765,-3.7006500000000004,915 240 864,915240864,,0,,/contenido/entidadesYorganismos/Museos
2084,wax-museum-of-madrid,https://wikidata.org/entity/Q15121263,,"Lunes a domingo, de 11 a 19 horas.",,"Metro: Colón (línea 4)  Bus: 14, 150, 27, 45, 5, 53, 21, 37, C03  Cercanías Renfe: Recoletos (líneas C1, C2, C7, C10)  Bicimad: Estación 10 (Calle Marqués de la Ensenada, 16) / estación 94 (Paseo de Recoletos, 20)  Aparcamiento: Colón (2), Plaza de Colón",,2,http://www.madrid.es/sites/v/index.jsp?vgnextchannel=bfa48ab43d6bb410VgnVCM100000171f5a0aRCRD&vgnextoid=9689ef4d7f71c010VgnVCM1000000b205a0aRCRD,recoletos,PASEO,V,41.0,,,,,MADRID,MADRID,28004,4,justicia,https://wikidata.org/entity/Q1992319,1,centro,https://wikidata.org/entity/Q1763376,441350,4475102,4413504475102,40.42448,-3.69138,913 199 330,913199330,,0,info@museoceramadrid.com,/contenido/entidadesYorganismos/Museos
2071,museo-de-escultura-al-aire-libre-de-la-castellana,https://wikidata.org/entity/Q2283575,"El Museo de Escultura al Aire Libre de La Castellana, está situado bajo el paso elevado que une las calles de Juan Bravo y Eduardo Dato, contiene una excelente colección de escultura abstracta española.",Entrada libre. Espacio urbano abierto Abierto 24 horas al día los 365 días del año.,,"Transporte público más próximo   Metro: Rubén Darío (línea 5)  Bus: 5, 14, 27, 45, 150  BICIMAD: Estación 142 (Paseo de la Castellana n&amp;ordm;42)",,1,http://www.madrid.es/sites/v/index.jsp?vgnextchannel=bfa48ab43d6bb410VgnVCM100000171f5a0aRCRD&vgnextoid=eca9ef4d7f71c010VgnVCM1000000b205a0aRCRD,castellana,PASEO,V,40.0,,,,,MADRID,MADRID,28046,6,castellana,https://wikidata.org/entity/Q4781,4,salamanca,https://wikidata.org/entity/Q1773521,441678,4476070,4416784476070,40.43321,-3.687612,915 885 921,915885921,,0,mmacmdifusion@madrid.es,/contenido/entidadesYorganismos/MonumentosEdificiosArtisticos
2054,museo-de-historia-de-madrid,https://wikidata.org/entity/Q876383,Fue creado como museo municipal en 1929 y rebautizado como Museo de Historia de Madrid en 2007. En el año 2014 se hace una profunda remodelación y reabre sus puertas con un montaje moderno y una puesta al día de sus colecciones.,"De martes a domingos de 10 a 20 horas.  Verano (Del 15 de junio al 15 de septiembre): de martes a domingos de 10 a 19 horas.  Cerrado: lunes y los días 1 y 6 de enero, 1 de mayo,  24, 25 y 31 de diciembre.   El desalojo de las salas se hará diez minutos antes del cierre.",Biblioteca de investigación Servicio de documentación Guardarropa Zona wifi  Tienda del museo. Contacto: tienda.museohistoria@palaciosymuseos.com Las reservas se realizarán a través de esta  plataforma,"Metro: Tribunal, Bilbao y Alonso Martínez.  Aparcamiento público: Barceló.",Accesibilidad física:   Rampa de acceso a la entrada. Ascensores. Aseos adaptados. Silla de ruedas.   Accesibilidad cognitiva:    Guía visual Museo de Historia de Madrid   Guía en lenguaje claro Museo de Historia de Madrid,"1,6",http://www.madrid.es/sites/v/index.jsp?vgnextchannel=bfa48ab43d6bb410VgnVCM100000171f5a0aRCRD&vgnextoid=8f3079262ef5d010VgnVCM1000000b205a0aRCRD,fuencarral,CALLE,V,78.0,,,,,MADRID,MADRID,28004,4,justicia,https://wikidata.org/entity/Q1992319,1,centro,https://wikidata.org/entity/Q1763376,440550,4475251,4405504475251,40.42577,-3.700845,917 011 863,917011863,,0,smuseosm@madrid.es,/contenido/entidadesYorganismos/MonumentosEdificiosArtisticos
4545827,museo-de-historia-de-la-comunidad-judia-de-madrid,,,,Visitas: info@cjmadrid.org,"Metro: Iglesia (línea 1)  Bus: 16, 61, 3, 37, 149, 5  Bicimad: Estación 246 (calle Santa Engracia, 87)",,1,http://www.madrid.es/sites/v/index.jsp?vgnextchannel=bfa48ab43d6bb410VgnVCM100000171f5a0aRCRD&vgnextoid=8f2a4a659ee71110VgnVCM1000000b205a0aRCRD,balmes,CALLE,V,3.0,,,,,MADRID,MADRID,28010,3,trafalgar,https://wikidata.org/entity/Q10384027,7,chamberi,https://wikidata.org/entity/Q1763370,440627,4476323,4406274476323,40.43543,-3.70002,915 913 131,915913131,,0,info@cjmadrid.org,/contenido/entidadesYorganismos/Museos
2095,museo-geominero,https://wikidata.org/entity/Q13532751,,"Lunes a viernes, de 10:30 a 14:30 horas (concertar previamente).",,"Cercanías Renfe: Cantoblanco (líneas C4, C4a y Cb).",,1,http://www.madrid.es/sites/v/index.jsp?vgnextchannel=bfa48ab43d6bb410VgnVCM100000171f5a0aRCRD&vgnextoid=255aef4d7f71c010VgnVCM1000000b205a0aRCRD,francisco-tomas-y-valiente,CALLE,V,7.0,,,,,MADRID,MADRID,28049,8,el-goloso,https://wikidata.org/entity/Q10271137,8,fuencarral-el-pardo,https://wikidata.org/entity/Q656196,441133,4488524,4411334488524,40.54537,-3.695183,914 974 819 / 914 972 564 / 914 974 800,914974819,914972564.0,914974900,museo.mineralogia@uam.es,/contenido/entidadesYorganismos/Museos
2112,museo-de-san-isidro,https://wikidata.org/entity/Q5556798,"Este espacio museográfico propone un viaje por la historia de la ciudad de Madrid desde la Prehistoria hasta el establecimiento de la Corte, a través de distintas salas como la de San Isidro, el Patio renacentista, el Jardín arqueobotánico o el Almacén visitable.","De martes a domingo y festivos de 10 a 20 horas.  Último pase de visita 15 minutos antes del cierre.    Verano, del 15 de junio al 15 de septiembre: de martes a domingo de 10 a 19 horas.  Cerrado todos los lunes, el 1 y 6 de enero, el 1 de mayo y los días 24, 25 y 31 de diciembre.","Sala de investigadores Biblioteca especializada en arqueología e historia madrileña Archivo documental Almacén visitable con más de 600 piezas arqueológicas (por cuestiones técnicas el almacén visitable puede estar cerrado durante su visita, en tal caso pregunte en el mostrador de entrada para que le faciliten el acceso) Jardín arqueobotánico, con información documentada sobre las especies de la ciudad (en estos momentos se encuentra cerrado por obras de rehabilitación) Investigadores: los fondos del Museo están a disposición de la comunidad científica y los investigadores podrán acceder tramitando su correspondiente solicitud Visitas guiadas por voluntarios culturales de CEATE Talleres didácticos para grupos escolares Zona wifi","Metro:  La Latina (línea 5) , Tirso de Molina (línea 1)",,"2,6",http://www.madrid.es/sites/v/index.jsp?vgnextchannel=bfa48ab43d6bb410VgnVCM100000171f5a0aRCRD&vgnextoid=7b7aef4d7f71c010VgnVCM1000000b205a0aRCRD,san-andres,PLAZA,V,2.0,,,,,MADRID,MADRID,28005,1,palacio,https://wikidata.org/entity/Q2136510,1,centro,https://wikidata.org/entity/Q1763376,439691,4473738,4396914473738,40.41207,-3.710816,913 667 415,913667415,,0,museosanisidro@madrid.es,/contenido/entidadesYorganismos/Museos
85301,museo-de-sanidad-e-higiene-publica,,"El Museo de Sanidad e Higiene Pública se comenzó a desarrollar en el año 1995 y es un centro único en su especialidad en España. Está ubicado en el Pabellón 14 del campus de Chamartín en el Instituto de Salud Carlos III, que albergaba los laboratorios del Hospital Nacional de Enfermedades Infecciosas, conocido como Hospital del Rey. El objetivo es gestionar para su difusión y conservación las colecciones de objetos, libros y documentos que reflejan los aspectos más significativos de la historia y evolución de la salud pública en nuestro país. De ese modo se busca la promoción de la investigación en este campo facilitando a los investigadores, profesores y técnicos que lo necesiten, apoyo técnico especializado.","Visitas guiadas de grupo con cita previa: de lunes a viernes laborables, a las 10 horas. Consultar horarios.",Solicitud de cita previa enviando formulario a museodesanidad@isciii.es.,"Metro: Chamartín (líneas 1, 10).  Bus: 124, 134, 135, 67, 147.  Cercanías Renfe: Chamartín (líneas C1, C2, C3, C3a, C4, C4a, C4b, C7, C8 y C10).",,3,http://www.madrid.es/sites/v/index.jsp?vgnextchannel=bfa48ab43d6bb410VgnVCM100000171f5a0aRCRD&vgnextoid=3e755c2cdc41c010VgnVCM2000000c205a0aRCRD,monforte-de-lemos,AVENIDA,V,5.0,,,,,MADRID,MADRID,28029,5,la-paz,https://wikidata.org/entity/Q5869740,8,fuencarral-el-pardo,https://wikidata.org/entity/Q656196,441508,4480761,4415084480761,40.47547,-3.690041,918 222 414,918222414,,0,museodesanidad@isciii.es,/contenido/entidadesYorganismos/Museos
4566286,museo-de-la-catedral-de-la-almudena,https://wikidata.org/entity/Q107611898,,"De lunes a sábado de 10 a 14:30 horas.   Cerrado los domingos, fiestas de precepto y días de actos de culto especiales en la Catedral. Consultar  Agenda .",,"Metro: Ópera (Líneas 2, 5 y Ramal Ópera Príncipe Pío).  Bus: 148, 3.  Bicimad: Estaciones 36 (plaza Ramales), 166 (calle Segovia, 26).","Para solicitar reserva de visita guiada, escriba a reservasmuseo@catedraldelaalmudena.es.",1,http://www.madrid.es/sites/v/index.jsp?vgnextchannel=bfa48ab43d6bb410VgnVCM100000171f5a0aRCRD&vgnextoid=82cb8d0e78d22110VgnVCM1000000b205a0aRCRD,bailen,CALLE,V,10.0,,,,,MADRID,MADRID,28013,1,palacio,https://wikidata.org/entity/Q2136510,1,centro,https://wikidata.org/entity/Q1763376,439452,4474125,4394524474125,40.41554,-3.713667,915 592 874,915592874,,0,reservasmuseo@catedraldelaalmudena.es,/contenido/entidadesYorganismos/Museos
2073,museo-de-la-farmacia-hispana,https://wikidata.org/entity/Q105942790,,"El Museo de la Farmacia Hispana solo puede visitarse realizando una reserva con antelación.La visita es gratuita, guiada y tiene una duración aproximada de 1 hora y media. Se realizan durante el curso lectivo, de lunes a viernes y en horario de mañana.  Este año vamos a empezar con las visitas guiadas en horario de tarde. Serán los martes y miércoles lectivos de octubre a mayo. La visita completa empezará a las 16:00 y durará 1 hora y media. Habrá también opción de visita abreviada de 17:00 a 18:00.   Las visitas de tarde podrán reservarse solo con un mes de antelación.",,"Metro: Ciudad Universitaria (línea 6).  Bus: 132, 82, G, U, I  Bicimad: Estaciones 258 ( Ciudad universitaria, 1)",,2,http://www.madrid.es/sites/v/index.jsp?vgnextchannel=bfa48ab43d6bb410VgnVCM100000171f5a0aRCRD&vgnextoid=58f9ef4d7f71c010VgnVCM1000000b205a0aRCRD,ramon-y-cajal,PLAZA,V,0.0,,,,,MADRID,MADRID,28040,3,ciudad-universitaria,https://wikidata.org/entity/Q3319235,9,moncloa-aravaca,https://wikidata.org/entity/Q2017682,438415,4477348,4384154477348,40.44451,-3.7262009999999997,913 941 797,913941797,,0,museofar@ucm.es,/contenido/entidadesYorganismos/Museos
2107,museo-de-la-guardia-civil,https://wikidata.org/entity/Q110560070,"El Museo de la Guardia Civil está encuadrado en el Servicio de Estudios Históricos de la Sede Central de la Guardia Civil. La dirección del museo la ejerce un Coronel de la Guardia Civil, auxiliado por un Oficial como Jefe del Negociado, un Suboficial como encargado y varios Guardias Civiles en activo, con las funciones de mantenimiento y vigilancia.  En los aspectos técnicos será auxiliado por un Oficial Facultativo, con el cometido de Conservador en base a su formación específica. Los primeros indicios y escritos en los que se refleja la inquietud de recopilar objetos de marcado carácter histórico relacionados con las actividades de la Guardia Civil datan del año 1914 (desaparecerá en 1936 con motivo de la Guerra Civil), si bien sería a principios de 1982, cuando por iniciativa del entonces Director General, Excmo. Señor Teniente General, D José Luis Aramburu Topete, se inician las labores para la creación del actual Museo de la Guardia Civil. El museo se crea por Orden General del Cuerpo, núm. 15, de 23 de junio de 1982 y es inaugurado el día 12 de octubre de 1982, por Su Majestad el Rey de España, D. Juan Carlos I de Borbón. Los fondos que forman el museo han sido aportados o depositados bien por entidades públicas o privadas y por las distintas Unidades del Cuerpo, todos los cuales están vinculados de alguna manera a las vicisitudes e historia de la Guardia Civil desde su creación hasta nuestros días. Todo ello ocupa una superficie total de 350 metros cuadrados, distribuidos en cuatro salas principales denominadas:  Banderas Sala de armas Sala de uniformes y maniquies Sala de objetos variados y dioramas.  También puedes visitar nuestro  'museo virtual' aquí .","Horario de visitas  Lunes a viernes de 09:00 a 13:30 horas.  Petición de visitas   No guiadas: Individuales y grupos reducidos (10 personas o menos). Con cita previa. El aforo máximo en las instalaciones será de 20 personas. Guiadas: No se realizarán. Todas las visitas quedarán condicionadas a la existencia de visitas institucionales, las cuales tendrán caracter preferente.",,"Metro: Guzmán el Bueno (líneas 6 y 7).  Bus: 2, 45, 44.  Bicimad: Estaciones 256 (calle Beatriz de Bobadilla, 2) y 203 (calle General Ampudia, 2).","Para contactar con el museo puede hacerlo de las siguientes maneras:    Correo ordinario   Dirección General de la  Guardia Civil.Calle Guzmán El Bueno, número 110. C.P. 28003 &amp;ndash; Madrid   Correo electrónico    dg-estuhistoricos-registro@guardiacivil.org    Teléfono   91 514 60 00, extensiones 48495 (Oficina Museo), 48477 (Salas Museo).",3,http://www.madrid.es/sites/v/index.jsp?vgnextchannel=bfa48ab43d6bb410VgnVCM100000171f5a0aRCRD&vgnextoid=003aef4d7f71c010VgnVCM1000000b205a0aRCRD,guzman-el-bueno,CALLE,V,110.0,,,,,MADRID,MADRID,28003,6,vallehermoso,https://wikidata.org/entity/Q6122685,7,chamberi,https://wikidata.org/entity/Q1763370,439594,4477325,4395944477325,40.44438,-3.7123,"915 146 000, extensiones 48495 (Oficina Museo), 48477 (Salas Museo)",915146000,484954847.0,0,dg-estuhistoricos-registro@guardiacivil.org,/contenido/entidadesYorganismos/Museos
2114,royal-academy-of-fine-arts-of-san-fernando,https://wikidata.org/entity/Q1322403,"Construido inicialmente para palacio de Don Juan de Goyeneche, el edificio fue adquirido por la Academia de Bellas Artes en 1773 y reformado bajo la dirección de Fernando Chueca Goitia en 1973 y la fachada por Diego de Villanueva en 1774.","Colección permanente: De martes a domingos, de 10 a 15 horas. Exposiciones temporales: consultar el apartado específico de la exposición temporal. Días cerrados: 1 y 6 de enero; 1 y 30 de mayo; 9 de noviembre; 24, 25 y 31 de diciembre. Las oficinas de la Real Academia de Bellas Artes abren de lunes a viernes, de 08.30 a 17.00 horas. Cerrada fines de semana y días festivos.",,"Metro: Sol (líneas 1, 2, 3), Sevilla (línea 2), Gran Vía (líneas 1 y 5).  Bus:  002, 46, 51, 150, 5, 15, 20, M3.  Cercanías Renfe: Sol (líneas C3, C4 y Regional).  Bicimad: Estaciones 1a y 1b (Puerta del Sol, 1) y 28 (calle Alcalá, 27).  Aparcamiento: Sevilla (41), calle Sevilla y calle Alcalá.",,1,http://www.madrid.es/sites/v/index.jsp?vgnextchannel=bfa48ab43d6bb410VgnVCM100000171f5a0aRCRD&vgnextoid=924aef4d7f71c010VgnVCM1000000b205a0aRCRD,alcala,CALLE,V,13.0,,,,,MADRID,MADRID,28014,6,sol,https://wikidata.org/entity/Q2465181,1,centro,https://wikidata.org/entity/Q1763376,440558,4474350,4405584474350,40.41765,-3.7006500000000004,915 240 864,915240864,,915241034,registro.museo@rabasf.com,/contenido/entidadesYorganismos/MonumentosEdificiosArtisticos
2066,railway-museum-of-madrid,https://wikidata.org/entity/Q6034436,"Edificio de carácter monumental. Proyectada por el ingeniero francés Émile Cacheliévre e inaugurada el 30 de marzo de 1880, la estación de Delicias fue la primera gran estación con carácter definitivo de Madrid.","De octubre a mayo:   Lunes a viernes, de 9:30 a 15 horas. Sábados y festivos, de 10 a 19 horas. Domingo, de 10 a 15 horas.   De junio a septiembre:   Lunes a domingo, de 10 a 15 horas.   Cerrado: 25 de diciembre, 1 y 6 de enero.","Mercado de Motores : segundo fin de semana del mes (excepto julio y agosto), de 11 a 21 horas. El Museo cierra en su actividad ordinaria y el acceso es gratuito (www.mercadodemotores.es).","Metro: Delicias (línea 3)  Bus: 19, 247, 45, 47, 59, 85, 86, 8, 55, 6  Cercanías Renfe: Delicias (líneas C1, C7, C10 y Regional)  Bicimad: Estación 172 (Bustamante, 1)",,1,http://www.madrid.es/sites/v/index.jsp?vgnextchannel=bfa48ab43d6bb410VgnVCM100000171f5a0aRCRD&vgnextoid=091c4291ae91f010VgnVCM2000000c205a0aRCRD,delicias,PASEO,V,61.0,,,,,MADRID,MADRID,28045,5,las-delicias,https://wikidata.org/entity/Q3773736,2,arganzuela,https://wikidata.org/entity/Q2000929,441124,4472418,4411244472418,40.40029,-3.693805,915 390 085,915390085,,0,taquillamuseo@ffe.es,/contenido/entidadesYorganismos/MonumentosEdificiosArtisticos
2058,museo-del-prado,https://wikidata.org/entity/Q160112,"La Biblioteca del Museo Nacional del Prado se encuentra situada en el Casón del Buen Retiro, actual sede del Centro de Estudios del Museo del Prado. Está especializada en artes plásticas europeas entre la Edad Media y el siglo XIX. Conserva un destacado patrimonio bibliográfico, de impresos y manuscritos anteriores a 1910, de notable importancia por su cantidad (unos 7.000 volúmenes), por su carácter especializado (tratados de pintura y arquitectura, libros de fiestas, cartillas de dibujo y libros de iconografía, emblemas, anatomía y fisiognomía) y por la rareza de algunos de sus ejemplares.","De lunes a sábado, de 10 a 20 horas. Domingos y festivos, de 10 a 19 horas. Cerrado los días 1 de enero, 1 de mayo y 25 de diciembre. Horario reducido, de 10 a 14 horas (6 de enero y 24 y 31 de diciembre).  Horario de gratuidad:  De lunes a sábado, de 18 a 20 horas. Domingos y festivos, de 17 a 19 horas.  Acceso al Museo hasta 30 minutos antes del cierre.",,"Metro: Estación del Arte (línea 1), Banco de España (línea 2).  Bus: E1,  203, 14,  27, 37, 45, C03, 1, 146, 15, 2, 20, 51, 52, 74, 9, 10, 34, 001, 53, 150, 5  Cercanías Renfe: Atocha (líneas C1, C2, C3, C4, C5, C7 y C10).  Aparcamiento: Plaza de Santa Ana (Plaza de Santa Ana, 328)",,"1,4,6",http://www.madrid.es/sites/v/index.jsp?vgnextchannel=bfa48ab43d6bb410VgnVCM100000171f5a0aRCRD&vgnextoid=060079262ef5d010VgnVCM1000000b205a0aRCRD,prado,PASEO,V,0.0,,,,,MADRID,MADRID,28014,5,jeronimos,https://wikidata.org/entity/Q10306766,3,retiro,https://wikidata.org/entity/Q2002296,441243,4474443,4412434474443,40.41854,-3.692583,910 683 001,910683001,,0,cav@museodelprado.es,/contenido/entidadesYorganismos/BibliotecasPatrimoniales
2086,museo-del-reloj-grassy,,Arquitecto: Eladio Laredo Carranza (1916 - 1917).,Visitas guiadas:   Miércoles 12 horas. Jueves 17:30 horas.,,"Metro: Banco de España (línea 2), Sevilla (línea 2), Gran Vía (Líneas 1 y 5).  Bus: 001, 1, 002, 2, 3, 5, 9, 15, 20, 23, 46, 51, 52, 53, 74, 146,  150  Bicimad: Estación 28 (calle Alcalá, 27) / Estación 20a (Calle Alcalá 49)  Aparcamiento: Plaza del Rey (54) / Pedro Zerolo (71)",,3,http://www.madrid.es/sites/v/index.jsp?vgnextchannel=bfa48ab43d6bb410VgnVCM100000171f5a0aRCRD&vgnextoid=daeaef4d7f71c010VgnVCM1000000b205a0aRCRD,gran-via,CALLE,V,1.0,,,,,MADRID,MADRID,28013,3,cortes,https://wikidata.org/entity/Q2535637,1,centro,https://wikidata.org/entity/Q1763376,440779,4474514,4407794474514,40.41914,-3.6980649999999997,915 321 007,915321007,,0,info@grassy.es,/contenido/entidadesYorganismos/Museos
2059,museum-of-romanticism,https://wikidata.org/entity/Q6974501,,"Horario de invierno (de noviembre a abril): De martes a sábado: de 9:30 a 18:30. Domingos y festivos: de 10 a 15 horas.  Horario de verano (de mayo a octubre): De martes a sábado: de 9:30 a 20:30. Domingos y festivos: de 10 a 15 horas.  Cerrado: Todos los lunes, 1 y 6 enero, 1 mayo, 9 noviembre, 24, 25 y 31 diciembre.",,"Metro: Tribunal (líneas 1 y 10), Alonso Martínez (líneas 4, 5 y 10).  Bus: 37, 149, 40, 3.  Bicimad: Estaciones 7 (calle Hortaleza, 75), 54 (calle Barceló, 7).  Aparcamiento: Barceló (69) calle Barceló, s/n; Aparcamiento Escuelas de San Antón (91).","Descripción monumental  Construido para casa palacio del Marqués de Matallana por el arquitecto Manuel Rodríguez, dentro de unas líneas clasicistas, tiene algunas leves reminiscencias del barroco, como las molduras en forma de orejeras en los balcones. Las estancias nobles se organizan en torno a dos patios cuadrados. Conserva un interesante jardín romántico. A finales del siglo XVIII el inmueble pasó a estar habitado por los Condes de la Puebla del Maestre y después, desde junio de 1921, fue sede de la Comisaría Regia de Turismo, organismo creado por el II Marqués de la Vega-Inclán. En 1924 se convirtió en Museo Romántico y desde entonces ha sido restaurado e intervenido en diversas ocasiones con motivo de su funcionamiento como museo.  Desde 2001 a 2009 el Museo fue reformado y puesto a punto, en aplicación de un plan museológico consistente en su renovación, ampliando su ámbito temático desde lo meramente literario hasta lo histórico, político, artístico y decorativo, para dar una visión de conjunto de esta etapa de la vida española. Muestra la ambientación de una casa romántica. Posee obras de los pintores más importantes del siglo XIX (Goya, Madrazo y otros) junto a esculturas, muebles, porcelanas, abanicos y todo tipo de complementos decorativos que nos recuerdan la forma de vida de una familia burguesa del siglo XIX.","1,6",http://www.madrid.es/sites/v/index.jsp?vgnextchannel=bfa48ab43d6bb410VgnVCM100000171f5a0aRCRD&vgnextoid=706cef4d7f71c010VgnVCM1000000b205a0aRCRD,san-mateo,CALLE,V,13.0,,,,,MADRID,MADRID,28004,4,justicia,https://wikidata.org/entity/Q1992319,1,centro,https://wikidata.org/entity/Q1763376,440725,4475259,4407254475259,40.42586,-3.698768,914 481 045 / 914 480 163,914481045,914480163.0,914456940,informacion.romanticismo@cultura.gob.es,/contenido/entidadesYorganismos/Museos
6337393,museo-del-seguro-fundacion-mapfre,,,De lunes a viernes de 9 a 17 horas. Cerrado festivos y mes de agosto.  Visitas en grupo previa reserva en su página web .,,"Metro: Colón (línea 4).  Bus: 5, 14, 21, 27, 37, 45, 53,  150, C03.  Cercanías Renfe: Recoletos (Líneas C1, C2, C7, C10 y Regional).  Bicimad: Estaciones 26 (plaza de las Salesas, 7), 94 (paseo Recoletos, 20), 10 (calle Marqués de la Ensenada, 16).  Aparcamientos: Garaje Piamonte (96), calle Piamonte, 16; Colón (2), plaza de Colón; Villa de Paríz (67) plaza Villa de París.",,3,http://www.madrid.es/sites/v/index.jsp?vgnextchannel=bfa48ab43d6bb410VgnVCM100000171f5a0aRCRD&vgnextoid=479b95f8c72d5310VgnVCM2000000c205a0aRCRD,barbara-de-braganza,CALLE,V,14.0,,,,,MADRID,MADRID,28004,4,justicia,https://wikidata.org/entity/Q1992319,1,centro,https://wikidata.org/entity/Q1763376,441273,4474967,4412734474967,40.42326,-3.692277,,0,,0,,/contenido/entidadesYorganismos/Museos
