NOMBRE,HORARIO,TRANSPORTE,PLAZAS,ACCESIBILIDAD,CALLE,BARRIO,DISTRITO
Aparcamiento disuasorio Aviación Española,Abierto 24 horas,Autobuses:      EMT:  Línea 17 (destino Pl. Mayor) y línea 39 (destino Pl. España)  EMT (Líneas nocturnas): N19     Metro:      Aviación Española (L10),344,1,"CALLE FUENTE DE LIMA, 5",LAS AGUILAS,LATINA
Aparcamiento disuasorio Estadio Metropolitano Sur ES-02b,Horario de apertura de 6:00 h a 22:00 h los días laborables excepto los días de partido en el estadio Metropolitano,,3011,0,"AVENIDA ARCENTALES, 37",ROSAS,SAN BLAS-CANILLEJAS
Aparcamiento disuasorio Fuente de la Mora,Abierto 24 horas,"Autobuses:     EMT:  150      Cercanias:      Estación de cercanias Fuente de la Mora C1, C10      Tranvía:      ML1",368,1,"AVENIDA MANOTERAS, 1",VALDEFUENTES,HORTALEZA
Aparcamiento disuasorio Islazul,,"Autobuses:      EMT:  SE Plaza Elíptica &amp;ndash; Islazul, 118, E1, 35 y N16   EMT(Líneas nocturnas): N16      Metro:      La Peseta (L11)",224,1,"CALLE CALDERILLA, 1",BUENAVISTA,CARABANCHEL
Aparcamiento disuasorio Pitis,Abierto 24 horas,"Autobuses:     EMT:  64, 82      Cercanias:      Estación de cercanias Pitis C3, C8      Metro:       Línea 7",402,1,CALLE GLORIA FUERTES,FUENTELARREINA,FUENCARRAL-EL PARDO
Aparcamiento mixto. Alcántara,Abierto 24 horas,,121,0,"CALLE ALCANTARA, 26",GOYA,SALAMANCA
Aparcamiento mixto. Arquitecto Ribera,Abierto 24 horas,,318,0,"CALLE BARCELO, 2",JUSTICIA,CENTRO
Aparcamiento mixto. Avenida de América (intercambiador),Abierto 24 horas,,261,0,"AVENIDA AMERICA, 9",PROSPERIDAD,CHAMARTIN
Aparcamiento mixto. Avenida de Portugal,Horario de apertura de 6:00 h a 22:00 h los días laborables.Abierto 24 horas,,428,0,"AVENIDA PORTUGAL, 155",PUERTA DEL ANGEL,LATINA
Aparcamiento mixto. Brasil,Abierto 24 horas,,226,0,"CALLE SAN GERMAN, 7",CUATRO CAMINOS,TETUAN
Aparcamiento mixto. Casino de la Reina,Abierto 24 horas,,135,0,"CALLE CASINO, 3",EMBAJADORES,CENTRO
Aparcamiento mixto. Condesa de Gavia,El horario de apertura para la parte del aparcamiento rotacional es de lunes a viernes de 9:00h a 20:40h. Sábados de 9:00 a 14:30h.,,146,0,"PLAZA CONDESA DE GAVIA, 2",CUATRO CAMINOS,TETUAN
Aparcamiento mixto. Corona Boreal,Abierto 24 horas,,125,1,"CALLE PEREZ DE VICTORIA, 2",ARAVACA,MONCLOA-ARAVACA
Aparcamiento mixto. Daoíz y Velarde,Abierto 24 horas,,235,0,"AVENIDA CIUDAD DE BARCELONA, 156",PACIFICO,RETIRO
Aparcamiento mixto. Díaz Porlier,Abierto 24 horas,,203,0,"CALLE DIEGO DE LEON, 64",LISTA,SALAMANCA
Aparcamiento mixto. Encuentro,Abierto 24 horas,,104,0,"PLAZA ENCUENTRO, 5",MEDIA LEGUA,MORATALAZ
Aparcamiento mixto. Felipe II,Abierto 24 horas,,1175,0,"CALLE GOYA, 88",RECOLETOS,SALAMANCA
Aparcamiento mixto. Fernández Shaw,Abierto 24 horas,,245,0,"CALLE CARLOS Y GUILLERMO FERNANDEZ SHAW, 1",ADELFAS,RETIRO
Aparcamiento mixto. Fuencarral,Abierto 24 horas,,410,0,"CALLE FUENCARRAL, 121",TRAFALGAR,CHAMBERI
Aparcamiento mixto. Hernani,Abierto 24 horas,,115,0,"CALLE HERNANI, 79",CUATRO CAMINOS,TETUAN
Aparcamiento mixto. Jacinto Benavente,Abierto 24 horas,,285,0,"PLAZA JACINTO BENAVENTE, 6",CORTES,CENTRO
Aparcamiento mixto. José Castán Tobeñas,Abierto 24 horas,,226,0,"CALLE POETA JOAN MARAGALL, 57",CASTILLEJOS,TETUAN
Aparcamiento mixto. Marqués de Salamanca,Abierto 24 horas,,356,0,PLAZA MARQUES DE SALAMANCA,CASTELLANA,SALAMANCA
Aparcamiento mixto. Miguel Yuste,Abierto 24 horas,,168,0,"CALLE MIGUEL YUSTE, 64",SIMANCAS,SAN BLAS-CANILLEJAS
Aparcamiento mixto. Montalbán,Abierto 24 horas,,130,1,"CALLE MONTALBAN, 4",LOS JERONIMOS,RETIRO
Aparcamiento mixto. Orense,Abierto 24 horas,,129,0,"AVENIDA BRASIL, 2",CUATRO CAMINOS,TETUAN
Aparcamiento mixto. Pedro Zerolo 'antes denominado Vázquez de Mella',Abierto 24 horas,,107,0,"PLAZA PEDRO ZEROLO, 1",JUSTICIA,CENTRO
Aparcamiento mixto. Plaza de Oriente,Abierto 24 horas,,242,0,"PLAZA ORIENTE, 9",PALACIO,CENTRO
Aparcamiento mixto. Plaza de Santo Domingo,,,320,1,PLAZA SANTO DOMINGO,PALACIO,CENTRO
Aparcamiento mixto. Plaza Mayor,Abierto 24 horas,,415,0,"PLAZA MAYOR, 1",SOL,CENTRO
Aparcamiento mixto. Presidente Carmona,De lunes a domingo servicio ininterrumpidoAbierto 24 horas,,127,0,"AVENIDA GENERAL PERON, 21",CUATRO CAMINOS,TETUAN
Aparcamiento mixto. Recoletos,Abierto 24 horas,,102,0,"PASEO RECOLETOS, 4",RECOLETOS,SALAMANCA
Aparcamiento mixto. República Dominicana,Abierto 24 horas,,209,0,"PLAZA REPUBLICA DOMINICANA, 6",NUEVA ESPAÑA,CHAMARTIN
Aparcamiento mixto. Reyes Magos,Abierto 24 horas,,356,0,PLAZA REYES MAGOS,NIÑO JESUS,RETIRO
Aparcamiento mixto. San Cayetano,Abierto 24 horas,,222,0,"PLAZA SAN CAYETANO, 1",GUINDALERA,SALAMANCA
Aparcamiento mixto. San Germán II (antes General Yagüe),Abierto 24 horas,,419,0,"CALLE ORENSE, 48",CASTILLEJOS,TETUAN
Aparcamiento mixto. Sánchez Bustillo,Abierto 24 horas,,131,0,CALLE SANCHEZ BUSTILLO,EMBAJADORES,CENTRO
Aparcamiento mixto. Serrano I,Abierto 24 horas,,307,0,"CALLE SERRANO, 84",CASTELLANA,SALAMANCA
Aparcamiento mixto. Serrano II,Abierto 24 horas,,379,0,"CALLE SERRANO, 44",RECOLETOS,SALAMANCA
Aparcamiento mixto. Serrano III,Abierto 24 horas,,261,0,"CALLE SERRANO, 2",RECOLETOS,SALAMANCA
Aparcamiento mixto. Sevilla,Abierto 24 horas,,649,0,"CALLE ALCALA, 15",SOL,CENTRO
Aparcamiento mixto. Velázquez - Ayala,Abierto 24 horas,,443,0,"CALLE VELAZQUEZ, 47",RECOLETOS,SALAMANCA
Aparcamiento mixto. Velázquez - Jorge Juan,Abierto 24 horas,,548,1,"CALLE VELAZQUEZ, 1",RECOLETOS,SALAMANCA
Aparcamiento mixto. Verdaguer y García,Abierto 24 horas,,83,0,"CALLE VERDAGUER Y GARCIA, 2",SAN PASCUAL,CIUDAD LINEAL
Aparcamiento público. Almagro,Abierto 24 horas,,463,0,"CALLE ALMAGRO, 24",ALMAGRO,CHAMBERI
Aparcamiento público. Auditorio Nacional de Música (Príncipe de Vergara),Abierto 24 horas,,376,1,"CALLE CARTAGENA, 178",CIUDAD JARDIN,CHAMARTIN
Aparcamiento público. Descalzas,Abierto 24 horas,,400,1,"PLAZA DESCALZAS, 3",SOL,CENTRO
Aparcamiento público. Glorieta Puerta de Toledo,Abierto 24 horas,,240,1,GLORIETA PUERTA DE TOLEDO,EMBAJADORES,CENTRO
Aparcamiento público. Las Cortes,Abierto 24 horas,,480,1,"PLAZA CORTES, 13",CORTES,CENTRO
Aparcamiento público. Luna - Tudescos (cerrado),Abierto 24 horas,,481,1,"PLAZA SANTA MARIA SOLEDAD TORRES ACOSTA, 2",UNIVERSIDAD,CENTRO
Aparcamiento público. Marqués de Urquijo,Abierto 24 horas,,482,0,CALLE MARQUES DE URQUIJO,ARGUELLES,MONCLOA-ARAVACA
Aparcamiento público. Mostenses,Abierto 24 horas,,361,1,"CALLE GARCIA MOLINAS, 4",UNIVERSIDAD,CENTRO
Aparcamiento público. Museo de la Ciudad,Abierto 24 horas,,147,0,"CALLE PRINCIPE DE VERGARA, 134",CIUDAD JARDIN,CHAMARTIN
Aparcamiento público. Olavide,Abierto 24 horas,,397,0,"PLAZA OLAVIDE, 17",TRAFALGAR,CHAMBERI
Aparcamiento público. Plaza de Colón,Abierto 24 horas,,611,1,"CALLE GOYA, 2",RECOLETOS,SALAMANCA
Aparcamiento público. Plaza de España,Abierto 24 horas,,800,0,"PLAZA ESPAÑA, 1",PALACIO,CENTRO
Aparcamiento público. Plaza del Carmen (cerrado),Abierto 24 horas,,450,0,"PLAZA CARMEN, 10",SOL,CENTRO
Aparcamiento público. Plaza del Rey,Abierto 24 horas,,170,0,"PLAZA REY, 1",JUSTICIA,CENTRO
Aparcamiento público. San Epifanio,Actualmente Cerrado,,501,1,"CALLE SAN EPIFANIO, 9",IMPERIAL,ARGANZUELA
Aparcamiento público. Santa Ana (cerrado),Abierto 24 horas,,325,1,PLAZA SANTA ANA,CORTES,CENTRO
Aparcamiento público. Usera,,,36,0,"CALLE AMPARO USERA, 46",MOSCARDO,USERA
Aparcamiento público. Velázquez - Juan Bravo,Abierto 24 horas,,371,1,"CALLE VELAZQUEZ, 88",CASTELLANA,SALAMANCA
Aparcamiento público. Villa de París,Abierto 24 horas,,169,1,"PLAZA VILLA DE PARIS, 1",JUSTICIA,CENTRO
,,,,,,,
